{
  "schema_version": "1.0.0",
  "project_id": "proj_demo",
  "run_id": "run_hello_001",
  "trace_id": "run_hello_001",
  "name": "answer-user-question",
  "agent_name": "demo-agent",
  "agent_version": "0.1.0",
  "config_hash": "cfg_abc123",
  "environment": "dev",
  "status": "succeeded",
  "started_at": "2026-07-23T09:15:30.000Z",
  "ended_at": "2026-07-23T09:15:32.500Z",
  "tags": ["smoke", "hello-trace"],
  "attributes": {
    "task": "What is Sentinel AI?"
  },
  "sdk": {
    "name": "sentinel-sdk-python",
    "version": "0.0.0-dev",
    "language": "python"
  }
}
